{
  "$schema": "https://json-schema.org/draft/2020-12/schema",
  "versao": "1.0.0",
  "dataGeracao": "2026-09-14T14:00:00-03:00",
  "totalHabilidades": 26,
  "dominios": [
    "ritmo",
    "ouvido",
    "leitura",
    "tecnica",
    "acompanhamento",
    "harmonia",
    "solo/arranjo",
    "expressao/criacao"
  ],
  "habilidades": [
    {
      "id": "hab-rit-001",
      "nome": "Manutenção de Pulso Isócrono",
      "dominio": "ritmo",
      "acaoObservavel": "Bater e contar o pulso em 4/4 de forma contínua e uniforme a 60 BPM",
      "condicoes": "Sem instrumento ou em cordas abafadas, utilizando metrônomo de referência ou contagem verbal",
      "evidenciaEsperada": "16 compassos consecutivos sem aceleração, desaceleração involuntária ou parada",
      "prerequisitos": [],
      "tarefaDiagnostica": "Ligue o metrônomo a 60 BPM. Conte '1, 2, 3, 4' em voz alta batendo o pé ou a mão no tempo.",
      "rotaRecuperacao": "Reduzir o andamento para 50 BPM e praticar caminhada sincronizada com o pulso.",
      "fontesCandidatas": [
        "aula-mod-1-2",
        "aula-mod-1-8"
      ]
    },
    {
      "id": "hab-rit-002",
      "nome": "Subdivisão Rítmica de Colcheias",
      "dominio": "ritmo",
      "acaoObservavel": "Subdividir o tempo em duas partes iguais pronunciando '1 e 2 e 3 e 4 e'",
      "condicoes": "Marcando o tempo principal com o pé e o contratempo com as mãos em cordas abafadas",
      "evidenciaEsperada": "8 compassos mantendo a distância temporal exata entre o tempo e o contratempo",
      "prerequisitos": [
        "hab-rit-001"
      ],
      "tarefaDiagnostica": "Com o metrônomo a 60 BPM, marque o pulso e toque duas palhetadas para baixo e para cima por tempo.",
      "rotaRecuperacao": "Falar a contagem sem o violão até automatizar a divisão simétrica do tempo.",
      "fontesCandidatas": [
        "aula-mod-1-2",
        "aula-mod-4-35"
      ]
    },
    {
      "id": "hab-rit-003",
      "nome": "Execução da Levada Balada Básica",
      "dominio": "ritmo",
      "acaoObservavel": "Executar o padrão rítmico de balada (baixo-baixo-cima-baixo-cima) mantendo a quadratura",
      "condicoes": "Violão afinado, cordas abafadas ou acordes simples em andamento de 60 a 72 BPM",
      "evidenciaEsperada": "8 repetições contínuas do ciclo da levada sem interrupção na virada do compasso",
      "prerequisitos": [
        "hab-rit-002"
      ],
      "tarefaDiagnostica": "Toque o ciclo da levada 4 vezes consecutivas em cordas abafadas registrando o áudio.",
      "rotaRecuperacao": "Isole a transição entre o tempo 2 e o tempo 3 em andamento reduzido (50 BPM).",
      "fontesCandidatas": [
        "aula-mod-1-17"
      ]
    },
    {
      "id": "hab-rit-004",
      "nome": "Levada Pop Swing / Balada com Variação",
      "dominio": "ritmo",
      "acaoObservavel": "Sustentar levada pop swing com toques acentuados nos tempos 2 e 4",
      "condicoes": "Acompanhando metrônomo ou playback simples",
      "evidenciaEsperada": "Manter acento sonoro distinto nos tempos 2 e 4 durante 12 compassos",
      "prerequisitos": [
        "hab-rit-003"
      ],
      "tarefaDiagnostica": "Toque a levada pop acentuando os tempos 2 e 4 com o polegar ou indicador.",
      "rotaRecuperacao": "Praticar palmas nos tempos 2 e 4 sobre playback de música pop.",
      "fontesCandidatas": [
        "aula-kaiser-18-5-thumb-slap-batida-fingerstyle",
        "aula-mod-6-25"
      ]
    },
    {
      "id": "hab-rit-005",
      "nome": "Levada de Bossa Nova Básica (Estilo João Gilberto)",
      "dominio": "ritmo",
      "acaoObservavel": "Executar a célula rítmica de bossa nova com polegar no baixo e dedos i-m-a no acorde",
      "condicoes": "Síncopa característica com baixo marcando tempos 1 e 3 e acorde antecipado",
      "evidenciaEsperada": "8 compassos contínuos preservando a independência entre baixo uniforme e acorde sincopado",
      "prerequisitos": [
        "hab-rit-003",
        "hab-tec-004"
      ],
      "tarefaDiagnostica": "Isole o polegar marcando o tempo 1 e 3 enquanto os dedos puxam o acorde nos contratempos.",
      "rotaRecuperacao": "Praticar primeiro somente o polegar em semínimas e depois adicionar um único acorde sincopado.",
      "fontesCandidatas": [
        "aula-mod-5-30",
        "aula-mod-6-1"
      ]
    },
    {
      "id": "hab-rit-006",
      "nome": "Levada de Samba e Choro",
      "dominio": "ritmo",
      "acaoObservavel": "Executar o tamborim rítmico do samba e a condução de choro ao violão",
      "condicoes": "Andamento moderado de samba (70 a 85 BPM), violão de nylon",
      "evidenciaEsperada": "Execução com clareza dos acentos no segundo tempo do compasso binário",
      "prerequisitos": [
        "hab-rit-005"
      ],
      "tarefaDiagnostica": "Toque levada de samba em 2/4 em sequência C - G7 mantendo o molho rítmico.",
      "rotaRecuperacao": "Ouvir a faixa de percussão e bater a caixa rítmica no tampo do violão.",
      "fontesCandidatas": [
        "aula-mod-6-6",
        "aula-kaiser-167-1-samba-da-bencao-baden-powell"
      ]
    },
    {
      "id": "hab-rit-007",
      "nome": "As Levadas de Baden Powell (Mão Direita)",
      "dominio": "ritmo",
      "acaoObservavel": "Executar os padrões rítmicos afro-brasileiros de Baden Powell com ataque percussivo",
      "condicoes": "Violão de nylon, uso do polegar pesado e rasgueado leve com dedos",
      "evidenciaEsperada": "Execução das levadas características mantendo pulso implacável e dinâmica expressiva",
      "prerequisitos": [
        "hab-rit-006"
      ],
      "tarefaDiagnostica": "Toque o padrão de Berimbau ou Canto de Ossanha em andamento estável.",
      "rotaRecuperacao": "Isole o movimento de abafamento da mão esquerda combinado ao rasgueado da direita.",
      "fontesCandidatas": [
        "aula-kaiser-36-4-aula-da-levada-1-exercicio-2-batida-co",
        "aula-kaiser-172-14-berimbau-baden-powell-afro-samba"
      ]
    },
    {
      "id": "hab-ouv-001",
      "nome": "Discriminação de Alturas Relativas (Grave vs. Agudo)",
      "dominio": "ouvido",
      "acaoObservavel": "Identificar corretamente se a segunda nota soada é mais aguda ou mais grave que a primeira",
      "condicoes": "Teste auditivo cego com 10 pares de notas no violão ou áudio de referência",
      "evidenciaEsperada": "Mínimo de 9 acertos em 10 tentativas",
      "prerequisitos": [],
      "tarefaDiagnostica": "Ouça 5 pares de notas sem olhar para o braço e anote 'subiu' ou 'desceu'.",
      "rotaRecuperacao": "Praticar com extremos do violão (6ª corda solta vs. 1ª corda solta) até refinar a percepção.",
      "fontesCandidatas": [
        "aula-mod-1-15"
      ]
    },
    {
      "id": "hab-ouv-002",
      "nome": "Reconhecimento Auditivo de Intervalos (2ªM e 3ªM)",
      "dominio": "ouvido",
      "acaoObservavel": "Identificar por escuta se o intervalo ascendente tocado é uma 2ª Maior (tom) ou 3ª Maior (dois tons)",
      "condicoes": "Áudio sem pista visual, notas soadas consecutivamente",
      "evidenciaEsperada": "Mínimo de 8 acertos em 10 comparações",
      "prerequisitos": [
        "hab-ouv-001"
      ],
      "tarefaDiagnostica": "Escute 10 intervalos tocados e classifique cada um como 2ª Maior ou 3ª Maior.",
      "rotaRecuperacao": "Associar o som da 2ªM ao início de 'Parabéns pra Você' e da 3ªM ao início de 'Brahms Lullaby'.",
      "fontesCandidatas": [
        "aula-mod-1-15",
        "aula-mod-1-16"
      ]
    },
    {
      "id": "hab-ouv-003",
      "nome": "Entoação Vocal de Intervalos Diatônicos",
      "dominio": "ouvido",
      "acaoObservavel": "Cantar a nota de destino (2ªM ou 3ªM) a partir de uma nota fundamental soada no violão",
      "condicoes": "Violão toca uma nota de referência, o aluno canta a nota superior e confere tocando no instrumento",
      "evidenciaEsperada": "Afinar a nota cantada em uníssono com a conferência no instrumento em 4 de 5 tentativas",
      "prerequisitos": [
        "hab-ouv-002"
      ],
      "tarefaDiagnostica": "Toque a nota Dó, cante a 2ª Maior (Ré) e depois toque a casa correspondente para checar.",
      "rotaRecuperacao": "Tocar a nota junto com a voz antes de tentar cantar antes de tocar.",
      "fontesCandidatas": [
        "aula-mod-1-15"
      ]
    },
    {
      "id": "hab-ouv-004",
      "nome": "Reconhecimento de Tríades Maiores e Menores",
      "dominio": "ouvido",
      "acaoObservavel": "Distinguir auditivamente a sonoridade de um acorde Maior de um acorde Menor",
      "condicoes": "Áudio com 10 acordes soados simultaneamente de forma arpejada ou em bloco",
      "evidenciaEsperada": "Mínimo de 9 acertos em 10 acordes apresentados",
      "prerequisitos": [
        "hab-ouv-002"
      ],
      "tarefaDiagnostica": "Classifique 10 acordes ouvidos como 'Maior' (solar/aberto) ou 'Menor' (melancólico/fechado).",
      "rotaRecuperacao": "Ouvir o arpejo lento destacando a 3ª do acorde (maior vs menor).",
      "fontesCandidatas": [
        "aula-mod-6-5",
        "aula-kaiser-23-1-comece-pelo-simples"
      ]
    },
    {
      "id": "hab-ouv-005",
      "nome": "Tirar Frase Melódica Curta de Ouvido",
      "dominio": "ouvido",
      "acaoObservavel": "Localizar e tocar no violão uma melodia de 4 a 6 notas ouvida sem partitura",
      "condicoes": "Frase gravada em primeira posição, em tonalidade de Dó Maior ou Sol Maior",
      "evidenciaEsperada": "Reproduzir a melodia correta no violão após no máximo 5 tentativas de escuta",
      "prerequisitos": [
        "hab-ouv-003",
        "hab-lei-002"
      ],
      "tarefaDiagnostica": "Ouça a melodia de 'Cai Cai Balão' e encontre as notas na 1ª e 2ª cordas do violão.",
      "rotaRecuperacao": "Cantarolar a frase antes de colocar os dedos nas cordas para fixar o desenho melódico.",
      "fontesCandidatas": [
        "aula-kaiser-164-7-cai-cai-balao"
      ]
    },
    {
      "id": "hab-lei-001",
      "nome": "Identificação das Cordas Soltas e Cifras Básicas",
      "dominio": "leitura",